{
  "schema": 1,
  "note": "How the sim's fx events become sound cues (audio/audio_cues.gd). Sounds, thresholds, scaling and grunt rules live here, not in code. Damage amounts are the sim's own: over three seeded 90 s matches the median hit was 29.5, the 75th percentile 74 and the 90th percentile 101, with beam hits up to about 300. Crater energy ran from 0.24 to 15.3 with a median of 2.6.",
  "fighters": {
    "KAI": "protagonist",
    "VORR": "anti_hero"
  },
  "sounds": {
    "impact.light": {
      "bus": "Sfx",
      "priority": 40,
      "caption": "[hit]"
    },
    "impact.heavy": {
      "bus": "Sfx",
      "priority": 60,
      "caption": "[heavy hit]"
    },
    "impact.crater": {
      "bus": "Sfx",
      "priority": 55,
      "caption": "[crash]"
    }
  },
  "damage": {
    "classes": [
      {
        "below": 26.0,
        "sound": "impact.light"
      },
      {
        "below": 1000000.0,
        "sound": "impact.heavy"
      }
    ],
    "ref": 40.0,
    "pitch_exp": -0.22,
    "pitch_min": 0.75,
    "pitch_max": 1.25,
    "gain_exp": 0.5,
    "gain_db_min": -6.0,
    "gain_db_max": 3.0
  },
  "crater": {
    "sound": "impact.crater",
    "min_energy": 0.45,
    "ref": 2.6,
    "pitch_exp": -0.25,
    "pitch_min": 0.7,
    "pitch_max": 1.3,
    "gain_exp": 0.55,
    "gain_db_min": -8.0,
    "gain_db_max": 3.0
  },
  "grunts": [
    {
      "on": "damage",
      "who": "attacker",
      "gesture": "effort.heavy",
      "min_amount": 26.0,
      "chance": 0.75,
      "cooldown_s": 1.1,
      "priority": 70,
      "gain_db": -2.0
    },
    {
      "on": "damage",
      "who": "victim",
      "pool": {
        "pain.limb": 0.7,
        "pain.head": 0.3
      },
      "min_amount": 8.0,
      "chance": 0.55,
      "cooldown_s": 0.7,
      "priority": 65,
      "gain_db": -3.0,
      "pitch_per_ln": 0.07,
      "ref": 40.0,
      "note": "Until damage events carry the region hit, the gesture is drawn from the pool; then it follows the region (head: pain.head, limbs and core: pain.limb)."
    }
  ],
  "muffle": {
    "below_y": 0.0,
    "over_sea_only": true
  },
  "variation": {
    "pitch": 0.03,
    "gain_db": 1.0
  },
  "flash": {
    "gain_db": -4.0,
    "bus": "Sfx",
    "priority_base": 100,
    "priority_step": 3,
    "rank": {
      "surge": 1,
      "danger": 2,
      "found": 3,
      "searching": 4,
      "brink": 5,
      "fear": 6,
      "rage": 7,
      "hurt": 8,
      "resolve": 9,
      "triumph": 10,
      "pride": 11,
      "taunt": 12
    },
    "note": "Head-flash cues (docs/art/flash-prototype-spec.md). Priority follows Art's rank: the surge outranks everything. Rendering calls AudioCues.flash(S, actor, id) when a flash starts, or emits a cosmetic flash event {actor, id}."
  }
}
